{"as_of":"2026-08-14","portfolio_ref":"experimental-portfolio/sha256/b712e19eafa99920a14c4d6330c60b18ea6bbbffccf48bb4e623859a9817e236","problem_card_schema":"AMF_PROBLEM_CARD_1","problem_catalog_sha256":"65911bf7f9118f0b446d7c6e19c4e748e39188030d1d7b8b0931f77165a36a78","schema":"AMF_EXPERIMENTAL_PORTFOLIO_1","source_schema_version":1,"summary":{"audited_active":3,"experimental_active":11,"total":14,"verifier_regression_only":0},"targets":[{"claim_scope":"FINITE_INSTANCE","formalization_level":"executable_spec","hard_gates":{"exact_target":"pass","open_status":"fail","reproducibility":"pass","valuable_partial_progress":"pass","verification_path":"pass"},"problem_card_sha256":"de580d02a3c94923e8a1458b917244fc06969acb9f43278881ea4810e7ba05d6","problem_id":"aim-60-first-prime","role":"experimental_active","strict_stage":"curated","target_card":{"bytes":2022,"path":"targets/aim-60-first-prime/target-card.json","sha256":"60ed7edbecbadd435f5ff041c07c10c4f584ce206b952456253bca5f54eca94d"},"verification_mode":"integer_factor_and_primality_certificates","verifier_id":"amf.aim60.certificate.v2"},{"claim_scope":"RECORD_IMPROVEMENT","formalization_level":"executable_spec","hard_gates":{"exact_target":"pass","open_status":"pass","reproducibility":"pass","valuable_partial_progress":"pass","verification_path":"pass"},"problem_card_sha256":"65362cb4c698596326ca70b0b996541a1ce823aa3dd9f435baf1841050871642","problem_id":"cage-cubic-g13-record","role":"experimental_active","strict_stage":"curated","target_card":{"bytes":1501,"path":"targets/cage-cubic-g13-record/target-card.json","sha256":"75d7e4a83a7d75ac57f62b992e8ab4743d27c6a578345bf67587d56d7cc30360"},"verification_mode":"exact_graph_regularity_and_girth_checker","verifier_id":"amf.cage3g13.exact.v1"},{"claim_scope":"FULL_PROBLEM","formalization_level":"executable_spec","hard_gates":{"exact_target":"pass","open_status":"conditional","reproducibility":"pass","valuable_partial_progress":"conditional","verification_path":"pass"},"problem_card_sha256":"56976f7b021e7a0a5d395bb6cf4155cdf8dbbe6c83d73833a1824bb0202012b8","problem_id":"costas-order-32","role":"experimental_active","strict_stage":"curated","target_card":{"bytes":1522,"path":"targets/costas-order-32/target-card.json","sha256":"f6a69cfa46e4487977dd8741d8157da4ebd9c76118284988dd06424524c9d188"},"verification_mode":"exact_permutation_displacement_checker","verifier_id":"amf.costas32.exact.v1"},{"claim_scope":"RECORD_IMPROVEMENT","formalization_level":"executable_spec","hard_gates":{"exact_target":"pass","open_status":"pass","reproducibility":"pass","valuable_partial_progress":"pass","verification_path":"pass"},"problem_card_sha256":"ff24ae26ddc2206625a765c5a67ff9bc7c360c42f0067ac4c2cff5aa4444eb73","problem_id":"degree-diameter-3-9-record","role":"audited_active","strict_stage":"active","target_card":{"bytes":1889,"path":"targets/degree-diameter-3-9-record/target-card.json","sha256":"bdd8f93bcc0fac09eb2a06fff262525b96e92c86486acba50484cd7189d74391"},"verification_mode":"exact_degree_connectivity_and_bfs_diameter_checker","verifier_id":"amf.dd39.exact.v1"},{"claim_scope":"FULL_PROBLEM","formalization_level":"proof_assistant","hard_gates":{"exact_target":"pass","open_status":"pass","reproducibility":"pass","valuable_partial_progress":"pass","verification_path":"pass"},"problem_card_sha256":"5c6df85fddf467f95b6ca416036b6ef588cd9d24adf08e60730441143a15dbb6","problem_id":"erdos-23","role":"experimental_active","strict_stage":"curated","target_card":{"bytes":1711,"path":"targets/erdos-23/target-card.json","sha256":"9b52b220c06cd6e9bc7503bf65be9c0b11d21eb5b381eca5648ce606786887dd"},"verification_mode":"exact_graph_plus_optimization_certificate_then_lean","verifier_id":"amf.erdos23.oddcycle.v1"},{"claim_scope":"FULL_PROBLEM","formalization_level":"proof_assistant","hard_gates":{"exact_target":"pass","open_status":"pass","reproducibility":"pass","valuable_partial_progress":"conditional","verification_path":"pass"},"problem_card_sha256":"97e5ffe1cf8f767285c4bb0ce4409e8edf2af874275cff8a97e27a1a6049d7b8","problem_id":"erdos-307","role":"experimental_active","strict_stage":"curated","target_card":{"bytes":1793,"path":"targets/erdos-307/target-card.json","sha256":"373bb9fdd07b800c778feee66a7aa6848357954d044a775cc480e51db12122b3"},"verification_mode":"exact_rational_then_lean","verifier_id":"amf.erdos307.exact.v1"},{"claim_scope":"FULL_PROBLEM","formalization_level":"proof_assistant","hard_gates":{"exact_target":"pass","open_status":"pass","reproducibility":"pass","valuable_partial_progress":"pass","verification_path":"pass"},"problem_card_sha256":"a75b3beccdf71f86bc425cecfe1485b82e849174ca528abf2351a4915f51b4e9","problem_id":"erdos-64","role":"audited_active","strict_stage":"active","target_card":{"bytes":2206,"path":"targets/erdos-64/target-card.json","sha256":"106f5e6d4ad516a7eee5e38e43244769dc5254ce10d357505c90c853dc53fbcd"},"verification_mode":"exact_bounded_graph_counterexample_checker","verifier_id":"amf.erdos64.counterexample.v1"},{"claim_scope":"FULL_PROBLEM","formalization_level":"proof_assistant","hard_gates":{"exact_target":"pass","open_status":"pass","reproducibility":"pass","valuable_partial_progress":"conditional","verification_path":"pass"},"problem_card_sha256":"ea439551025ad680a36ea4b4d8f9720b4a1c043d91c53359795f122c2a1253f7","problem_id":"erdos-7","role":"experimental_active","strict_stage":"curated","target_card":{"bytes":1721,"path":"targets/erdos-7/target-card.json","sha256":"6938ab8390fcdc8667384187752a3f02ab3fc963779bd61b724baaba32a30b58"},"verification_mode":"finite_modular_certificate_then_lean","verifier_id":"amf.erdos7.cover.v1"},{"claim_scope":"FULL_PROBLEM","formalization_level":"proof_assistant","hard_gates":{"exact_target":"pass","open_status":"pass","reproducibility":"pass","valuable_partial_progress":"pass","verification_path":"pass"},"problem_card_sha256":"20105fc0a5f58880e1c593ae23ed5c97286b8557fffd6cc93f9f3626707387ad","problem_id":"erdos-835","role":"experimental_active","strict_stage":"curated","target_card":{"bytes":1620,"path":"targets/erdos-835/target-card.json","sha256":"0fc489042d92dd266bcc330079dbefae77c7328576f98cc21d3967ab27e27ac0"},"verification_mode":"exact_coloring_or_sat_certificate_then_lean","verifier_id":"amf.erdos835.k10.v1"},{"claim_scope":"PARAMETER_RANGE","formalization_level":"executable_spec","hard_gates":{"exact_target":"pass","open_status":"conditional","reproducibility":"pass","valuable_partial_progress":"pass","verification_path":"pass"},"problem_card_sha256":"ea76325310731894f64a4b7f107d8b5c1ddd6667ad9cb614877c6980736ba787","problem_id":"frontier-ramsey-book","role":"experimental_active","strict_stage":"curated","target_card":{"bytes":1689,"path":"targets/frontier-ramsey-book/target-card.json","sha256":"eb7ec7db3ab71b9bff53ecf452b891a619ea3154c182816662a44ec76f9389fb"},"verification_mode":"exact_graph_checker","verifier_id":"amf.book.range100.v1"},{"claim_scope":"FINITE_INSTANCE","formalization_level":"executable_spec","hard_gates":{"exact_target":"pass","open_status":"pass","reproducibility":"pass","valuable_partial_progress":"pass","verification_path":"pass"},"problem_card_sha256":"19ce95159c145d2dc60ee76488506d38adf27814c32ef96c1cfb3b8f1d9654ff","problem_id":"frontier-small-diophantine","role":"experimental_active","strict_stage":"curated","target_card":{"bytes":1666,"path":"targets/frontier-small-diophantine/target-card.json","sha256":"4454286279548fcc2f186951cfbdfabfa45b694b0c2f7c3fbb46523a116a62f3"},"verification_mode":"exact_big_integer_substitution","verifier_id":"amf.diophantine.eq1.v1"},{"claim_scope":"BOUNDED_COUNTEREXAMPLE","formalization_level":"executable_spec","hard_gates":{"exact_target":"pass","open_status":"pass","reproducibility":"pass","valuable_partial_progress":"pass","verification_path":"pass"},"problem_card_sha256":"6d891e29afadbdc210962f87dc63add362ec2b1d5ee1a3de0886a70abef534c0","problem_id":"frontier-stretched-lr","role":"audited_active","strict_stage":"active","target_card":{"bytes":2460,"path":"targets/frontier-stretched-lr/target-card.json","sha256":"1ab87748125aa10d24229cadc47c8d04a99add70aeb42465b8be8232b458aad8"},"verification_mode":"exact_integer_polynomial_two_implementations","verifier_id":"amf.stretched-lr.exact.v1"},{"claim_scope":"RECORD_IMPROVEMENT","formalization_level":"proof_assistant","hard_gates":{"exact_target":"pass","open_status":"pass","reproducibility":"conditional","valuable_partial_progress":"pass","verification_path":"pass"},"problem_card_sha256":"6b508d2e7141025aa9d72ecfa16a40d876ed964886cbc7e81765495d4ce0b4bc","problem_id":"ramsey-r55","role":"experimental_active","strict_stage":"curated","target_card":{"bytes":1468,"path":"targets/ramsey-r55/target-card.json","sha256":"a5a10fa1c100ca492388ee729f04a897b33e1411aba3e844a6cf9cf1fe6f323d"},"verification_mode":"exact_graph_or_sat_certificate_then_lean","verifier_id":"amf.r55.graph43.v1"},{"claim_scope":"FULL_PROBLEM","formalization_level":"executable_spec","hard_gates":{"exact_target":"pass","open_status":"pass","reproducibility":"pass","valuable_partial_progress":"pass","verification_path":"pass"},"problem_card_sha256":"1d0bc82d2391ca8daad4ebca1aad0381141a863272fa810521d2123647ff79e9","problem_id":"srg-69-20-7-5","role":"experimental_active","strict_stage":"curated","target_card":{"bytes":1479,"path":"targets/srg-69-20-7-5/target-card.json","sha256":"1bfbb50ef8cb169eaa94da330a2f00828c5de60b1cfb01866724a507380bd216"},"verification_mode":"exact_adjacency_matrix_identity_checker","verifier_id":"amf.srg692075.exact.v1"}],"verifier_registry_sha256":"1dac2db72030b8c0be6ae8d233e4665ef32583e72ad7abb3aaa65b734a0b3571"}
